{
  "$schema": "https://json-schema.org/draft/2020-12/schema",
  "additionalProperties": false,
  "properties": {
    "id": {
      "oneOf": [
        {
          "type": "integer"
        },
        {
          "type": "string"
        },
        {
          "type": "null"
        }
      ]
    },
    "jsonrpc": {
      "enum": [
        "2.0"
      ],
      "type": "string"
    },
    "method": {
      "enum": [
        "raw/exact-file-image-cas"
      ],
      "type": "string"
    },
    "params": {
      "additionalProperties": false,
      "properties": {
        "contentBase64": {
          "type": "string"
        },
        "expectedCurrentSha256": {
          "type": "string"
        },
        "expectedResultSha256": {
          "type": "string"
        },
        "filePath": {
          "type": "string"
        },
        "mutationAttemptId": {
          "type": "string"
        },
        "mutationScratch": {
          "additionalProperties": false,
          "properties": {
            "preparedCleanupPath": {
              "type": "string"
            },
            "preparedPath": {
              "type": "string"
            },
            "quarantineCleanupPath": {
              "type": "string"
            },
            "quarantinePath": {
              "type": "string"
            },
            "targetFilePath": {
              "type": "string"
            }
          },
          "required": [
            "targetFilePath",
            "quarantinePath",
            "preparedPath",
            "preparedCleanupPath",
            "quarantineCleanupPath"
          ],
          "type": "object"
        }
      },
      "required": [
        "filePath",
        "expectedCurrentSha256",
        "contentBase64",
        "expectedResultSha256"
      ],
      "type": "object"
    }
  },
  "required": [
    "jsonrpc",
    "method",
    "params",
    "id"
  ],
  "title": "Kast raw/exact-file-image-cas JSON-RPC request",
  "type": "object"
}
