{
    "method": "raw/exact-file-image-cas",
    "params": {
        "filePath": "/workspace/src/Sample.kt",
        "expectedCurrentSha256": "fd31168346a51e49dbb21eca8e5d7cc897afe7116bb3ef21754f782ddb261f72",
        "contentBase64": "Ly8gZXhhY3QgaW1hZ2UgZXhhbXBsZQpwYWNrYWdlIHNhbXBsZQoKZnVuIGdyZWV0KCkgPSAiaGkiCgpmdW4gdXNlKCkgPSBncmVldCgpCg==",
        "expectedResultSha256": "b95525cb10f61f05f8d701ea043b498d31551050ae5ba67eea1bf59a6370f9f5"
    },
    "id": 1,
    "jsonrpc": "2.0"
}
